{
  "schema_version": "1.0",
  "format": "xijing-exam-paper",
  "exam": {
    "title": "2021年下半年信息安全工程师",
    "year": 2021,
    "session": "下半年",
    "exam_date": "2021-11-06",
    "qualification": "信息安全工程师",
    "level": "中级",
    "assets_base": "/data/exams/2021-isec/images",
    "sources": [
      "信管网（cnitpm.com）公开真题整理",
      "编程学习网（jsqmd.com）案例分析参考答案整理",
      "考生回忆版与教程示意图重建配图"
    ],
    "notes": "2021年信息安全工程师仅在11月举行一次考试（下半年）。下午卷共4道大题（试题一至试题四），总分75分。配图根据公开真题回忆与教程示意图重建，位于 public/data/exams/2021-isec/images。"
  },
  "papers": [
    {
      "id": "2021-11-am",
      "title": "综合知识（上午）",
      "subject": "基础知识",
      "paper_type": "choice",
      "duration_minutes": 150,
      "total_score": 75,
      "pass_score": 45,
      "question_count": 75,
      "questions": [
        {
          "external_id": "2021-11-am-q01",
          "number": 1,
          "type": "single",
          "score": 1,
          "stem": "常见的信息安全基本属性有：机密性、完整性、可用性、抗抵赖性和可控性等。其中合法许可的用户能够及时获取网络信息或服务的特性，是指信息安全的（）。",
          "options": {
            "A": "机密性",
            "B": "完整性",
            "C": "可用性",
            "D": "可控性"
          },
          "answer": "C"
        },
        {
          "external_id": "2021-11-am-q02",
          "number": 2,
          "type": "single",
          "score": 1,
          "stem": "2010年，首次发现针对工控系统实施破坏的恶意代码 Stuxnet（简称“震网”病毒），“震网”病毒攻击的是伊朗核电站西门子公司的（ ）系统。",
          "options": {
            "A": "Microsoft WinXP",
            "B": "Microsoft Win7",
            "C": "Google Android",
            "D": "SIMATIC WinCC"
          },
          "answer": "D"
        },
        {
          "external_id": "2021-11-am-q03",
          "number": 3,
          "type": "single",
          "score": 1,
          "stem": "要实现网络信息安全基本目标，网络应具备 ( )等基本功能。",
          "options": {
            "A": "预警、认证、控制、响应",
            "B": "防御、监测、应急、恢复",
            "C": "延缓、阻止、检测、限制",
            "D": "可靠、可用、可控、可信"
          },
          "answer": "B"
        },
        {
          "external_id": "2021-11-am-q04",
          "number": 4,
          "type": "single",
          "score": 1,
          "stem": "为防范国家数据安全风险，维护国家安全，保护公共利益，2021年7月，中国网络安全审查办公室发布公告，对“滴滴出行”“运满满”“货车帮”和“BOSS直聘”开展网络安全审查。此次审查依据的国家相关法律法规是（ ）。",
          "options": {
            "A": "《中华人民共和国网络安全法》和《中华人民共和国国家安全法》",
            "B": "《中华人民共和国网络安全法》和《中华人民共和国密码法》",
            "C": "《中华人民共和国数据安全法》和《中华人民共和国网络安全法》",
            "D": "《中华人民共和国数据安全法》和《中华人民共和国国家安全法》"
          },
          "answer": "A"
        },
        {
          "external_id": "2021-11-am-q05",
          "number": 5,
          "type": "single",
          "score": 1,
          "stem": "2021年6月10日，第十三届全国人民代表大会常务委员会第二十九次会议表决通过了《中华人民共和国数据安全法》，该法律自 ( ) 起施行。",
          "options": {
            "A": "2021年9月1日",
            "B": "2021年10月1日",
            "C": "2021年11月1日",
            "D": "2021年12月1日"
          },
          "answer": "A"
        },
        {
          "external_id": "2021-11-am-q06",
          "number": 6,
          "type": "single",
          "score": 1,
          "stem": "根据网络安全等级保护2.0的要求，对云计算实施安全分级保护。围绕“一个中心，三重防护”的原则，构建云计算安全等级保护框架。其中一个中心是指安全管理中心，三重防护包括：计算环境安全、区域边界安全和通信网络安全。以下安全机制属于安全管理中心的是（ ）。",
          "options": {
            "A": "应用安全",
            "B": "安全审计",
            "C": "Web服务",
            "D": "网络访问"
          },
          "answer": "B"
        },
        {
          "external_id": "2021-11-am-q07",
          "number": 7,
          "type": "single",
          "score": 1,
          "stem": "《中华人民共和国密码法》由中华人民共和国第十三届全国人民代表大会常务委员会第十四次会议于2019年10月26日通过，已于2020年1月1日起施行。《中华人民共和国密码法》规定国家对密码实行分类管理，密码分为（ ）。",
          "options": {
            "A": "核心密码、普通密码和商用密码",
            "B": "对称密码、公钥密码和哈希算法",
            "C": "国际密码、国产密码和商用密码",
            "D": "普通密码，涉密密码和商用密码"
          },
          "answer": "A"
        },
        {
          "external_id": "2021-11-am-q08",
          "number": 8,
          "type": "single",
          "score": 1,
          "stem": "现代操作系统提供的金丝雀（Canary）漏洞缓解技术属于 ( )",
          "options": {
            "A": "数据执行阻止",
            "B": "SEHOP",
            "C": "堆栈保护",
            "D": "地址空间随机化技术"
          },
          "answer": "C"
        },
        {
          "external_id": "2021-11-am-q09",
          "number": 9,
          "type": "single",
          "score": 1,
          "stem": "2021年7月30日，国务院总理李克强签署第745号国务院令，公布《关键信息基础设施安全保护条例》。该条例在法律责任部分，细化了在安全保护全过程中，各个环节违反相应条例的具体处罚措施。以下说法错误的是（ ）",
          "options": {
            "A": "在安全事故发生之前，运营者应当对关键信息基础设施的安全保护措施进行规划建设。在安全事故发生后，运营者未报告相关部门的，也会处以相应的罚金",
            "B": "对于受到治安管理处罚的人员，3年内不得从事网络安全管理和网络安全运营关键岗位的工作",
            "C": "对于受到刑事处罚的人员，终身不得从事网络安全管理和网络安全运营关键岗位的工作",
            "D": "网信部门、公安机关、保护工作部门和其他有关部门及其工作人员未履行相关职责或者玩忽职守、滥用职权、徇私舞弊的，或者发生重大责任事故的，会对相关监管、保护和服务人员给予处分，严重者追究法律责任"
          },
          "answer": "B"
        },
        {
          "external_id": "2021-11-am-q10",
          "number": 10,
          "type": "single",
          "score": 1,
          "stem": "网络攻击行为分为主动攻击和被动攻击，主动攻击一般是指攻击者对被攻击信息的修改，而被动攻击主要是收集信息而不进行修改等操作，被动攻击更具有隐蔽性。以下网络攻击中，属于被动攻击的是（ ）。",
          "options": {
            "A": "重放攻击",
            "B": "假冒攻击",
            "C": "拒绝服务攻击",
            "D": "窃听"
          },
          "answer": "D"
        },
        {
          "external_id": "2021-11-am-q11",
          "number": 11,
          "type": "single",
          "score": 1,
          "stem": "SYN 扫描首先向目标主机发送连接请求，当目标主机返回响应后，立即切断连接过程， 并查看响应情况。果目标主机返回（ ），表示目标主机的该端口开放。",
          "options": {
            "A": "SYN/ACK",
            "B": "RESET 信息",
            "C": "RST/ACK",
            "D": "ID头信息"
          },
          "answer": "A"
        },
        {
          "external_id": "2021-11-am-q12",
          "number": 12,
          "type": "single",
          "score": 1,
          "stem": "拒绝服务攻击是指攻击者利用系统的缺陷，执行一些恶意的操作，使得合法的系统用户不能及时得到应得的服务或系统资源。以下给出的攻击方式中，不属于拒绝服务攻击的是（ ）",
          "options": {
            "A": "SYN Flood",
            "B": "DNS放大攻击",
            "C": "SQL注入",
            "D": "泪滴攻击"
          },
          "answer": "C"
        },
        {
          "external_id": "2021-11-am-q13",
          "number": 13,
          "type": "single",
          "score": 1,
          "stem": "网络攻击者经常采用的工具主要包括：扫描器、远程监控、密码破解、网络嗅探器、安全渗透工具箱等。以下属于网络嗅探器工具的是（ ）。",
          "options": {
            "A": "SuperScan",
            "B": "LOphtCrack",
            "C": "Metasploit",
            "D": "WireShark"
          },
          "answer": "D"
        },
        {
          "external_id": "2021-11-am-q14",
          "number": 14,
          "type": "single",
          "score": 1,
          "stem": "为保护移动应用 App的安全性，通常采用防反编译、防调试、防篡改和防窃取等多种安全保护措施，在移动应用App程序插入无关代码属于( )技术。",
          "options": {
            "A": "防反编译",
            "B": "防调试",
            "C": "防篡改",
            "D": "防窃取"
          },
          "answer": "A"
        },
        {
          "external_id": "2021-11-am-q15",
          "number": 15,
          "type": "single",
          "score": 1,
          "stem": "密码算法可以根据密钥属性的特点进行分类，其中发送方使用的加密密钥和接收方使用的解密密钥不相同，并且从其中一个密钥难以推导出另一个密钥，这样的加密算法称为( )。",
          "options": {
            "A": "非对称密码",
            "B": "单密钥密码",
            "C": "对称密码",
            "D": "序列密码"
          },
          "answer": "A"
        },
        {
          "external_id": "2021-11-am-q16",
          "number": 16,
          "type": "single",
          "score": 1,
          "stem": "已知 DES 算法某 S 盒如下（行/列均从 0 起）：\n列→  0  1  2  3  4  5  6  7  8  9 10 11 12 13 14 15\n行0  14  4 13  1  2 15 11  8  3 10  6 12  5  9  0  7\n行1   0 15  7  4 14  2 13  1 10  6 12 11  9  5  3  8\n行2   4  1 14  8 13  6  2 11 15 12  9  7  3 10  5  0\n行3  15 12  8  2  4  9  1  7  5 11  3 14 10  0  6 13\n如果该 S 盒的输入为 010001，其二进制输出为（ ）。",
          "options": {
            "A": "0110",
            "B": "1001",
            "C": "0100",
            "D": "0101"
          },
          "answer": "C",
          "explanation": "输入 010001：第1、6 位组成行号 01(=1)，中间四位 1000(=8)；查第1行第8列得 4，即 0100。"
        },
        {
          "external_id": "2021-11-am-q17",
          "number": 17,
          "type": "single",
          "score": 1,
          "stem": "国产密码算法是指由国家密码研究相关机构自主研发，具有相关知识产权的商用密码算法。以下国产密码算法中，属于分组密码算法的是 ( )",
          "options": {
            "A": "SM2",
            "B": "SM3",
            "C": "SM4",
            "D": "SM9"
          },
          "answer": "C"
        },
        {
          "external_id": "2021-11-am-q18",
          "number": 18,
          "type": "single",
          "score": 1,
          "stem": "Hash 算法是指产生哈希值或杂凑值的计算方法。MD5算法是由Rivest 设计的Hash算法，该算法以512比特数据块为单位处理输入，产生（ ）的哈希值。",
          "options": {
            "A": "64比特",
            "B": "128比特",
            "C": "256比特",
            "D": "512比特"
          },
          "answer": "B"
        },
        {
          "external_id": "2021-11-am-q19",
          "number": 19,
          "type": "single",
          "score": 1,
          "stem": "数字签名是对以数字形式存储的消息进行某种处理，产生一种类似传统手书签名功效的信息处理过程。数字签名最常见的实现方式是基于 ( )",
          "options": {
            "A": "对称密码体制和哈希算法",
            "B": "公钥密码体制和单向安全哈希算法",
            "C": "序列密码体制和哈希算法",
            "D": "公钥密码体制和对称密码体制"
          },
          "answer": "B"
        },
        {
          "external_id": "2021-11-am-q20",
          "number": 20,
          "type": "single",
          "score": 1,
          "stem": "Diffie-Hellman密钥交换协议是一种共享秘钥的方案，该协议是基于求解( )的困难性。",
          "options": {
            "A": "大素数分解问题",
            "B": "离散对数问题",
            "C": "椭圆离散对数问题",
            "D": "背包问题"
          },
          "answer": "B"
        },
        {
          "external_id": "2021-11-am-q21",
          "number": 21,
          "type": "single",
          "score": 1,
          "stem": "计算机网络为了实现资源共享，采用协议分层设计思想，每层网络协议都有地址信息，如网卡（MAC）地址、IP地址、端口地址和域名地址，以下有关上述地址转换的描述错误的是 ( )。",
          "options": {
            "A": "DHCP协议可以完成IP地址和端口地址的转换",
            "B": "DNS协议可实现域名地址和IP地址之间的转换",
            "C": "ARP协议可以实现MAC地址和IP地址之间的转换",
            "D": "域名地址和端口地址无法转换"
          },
          "answer": "A"
        },